text,interpretation,functional_tags
"###Input :Husband with osteonecrosis and little game plan besides narcotics- is he being managed appropriately?Just a HUGE thanks in advance to anybody who responds. I'm a talker and I'm livid right now, so I'm trying to keep this just to necessities but may fail and leave out key details and/or talk about things that aren't necessary. To preface- I come from a ""medical family"" but it's primarily neuro and psych rather than ortho. I devour medical literature, podcasts, etc, have worked as nursing staff in psych and derm, just got my master's in health sciences, and am planning to apply to med school this cycle- so basically, please feel free to talk to me in technical terms, link to articles, etc as appropriate.Now onto the issue.Husband is 28M, 5'8.5"", 225lbs, white, occasionally smokes cigars (maybe a cigar or two a year?), and drinks moderately (down from heavy drinking a few years ago as part of work culture). About 5 weeks ago was diagnosed with osteonecrosis in both femoral heads. Started having pain just in his right hip in May, but really started to notice in June as it was limiting mobility. Got to the point in July where he couldn't go up and down the stairs- I was gone and he was texting me he had to army crawl back up the stairs to bed. Initially, he got an x-ray which had some ""fringe"" or something to that effect (I wasn't in the appointment so I don't really know what was said about it) but was concerning for possible osteonecrosis and MRI was recommended. While waiting, he went to PT, and the PT thought perhaps bursitis if not ON, but the pain kept worsening. Got an MRI at the end of August which showed osteonecrosis in both hips involving over 50% of both femoral heads. Right side had marked edema extending into the femoral neck and noted a ""mild asphericity of the head consistent with mild depression,"" subchondral fluid cleft, and diffusive mildly thinned cartilage. Left side had edema as well extending into the neck.Husband was referred to ortho, which in itself was a headache as PCP had to send that referral FOUR times. As we're waiting, his pain is getting worse to the point where he was using a cane and then progressed to needing a full set of crutches. If you could see his gait- it's just awful and was placing stress on other joints and was leading to back pain too. PCP started him on Celebrex 1000mg QAM for two weeks and then 500mg QAM after as well as gabapentin (titrated up to 900mg QHS). Got several labs drawn to check for a cause- including autoimmune labs- and the only abnormality was low vitamin D (15 ng/mL), so he was also started on OTC D3 5000IU daily and a prescription weekly dose of D2 (I can't remember the dosing). . The Celebrex seemed to help him the most, but after about a week on that, it was still only ""barely"" helping. As time went on waiting for ortho, the way he described the pain and sensation also changed, with more ""grinding"" pain.In what I've been able to read, it seems there are treatments that can help the pain (narcotics, staying off the joint, fluid aspiration for edema) and may treat earlier stages of disease (eg, core decompression, treating underlying cause to get blood flow back to the bone), but once the femoral head collapses, hip replacement becomes standard of care.When we were finally able to meet with ortho, the doc, while personable and nice, didn't really give us a lot of info. He didn't stage the disease at time of MRI, but kept saying ""mild."" This annoys me because with the amount of pain he is in and asphericity of the femoral head, I wouldn't classify anything he's experiencing as ""mild"" myself, and surely not ""caught early/in early disease stage."" We tried to impress the pain aspect and how limited his mobility is because of the pain. Doc kept hinting at ""something stronger"" to manage the pain and said we could schedule for aspiration for the edema. Also mentioned that he needed to stay off the joint as much as possible and should be using the crutches for any walking. Husband is terrified of needles (aspiration is done fully conscious and may need to be done every week or two to control pain from the edema), and with a history of SUDs in his family, being on narcotics for longer than a few days is also terrifying and he prefers not to. We asked about hip replacement, and he seemed not to want to do it, citing Husband's age. ORtho requested workup for potential coagulation disorder because we could ""save the hips"" if this was caused by a treatable clotting disorder, and he referred to hematology. No further discussion about replacement or why he didn't want to pursue it- just the age and potential for a clotting disorder.Neither one of us was thrilled with this. I wasn't convinced that restoring blood flow would magically re-shape his femoral head, especially with how he is now describing grinding pain. His half sister also does have a clotting disorder, but it's Factor V deficiency, so it's that she doesn't clot appropriately. But fine. Took them a week to get the referral to hematology, and a few days later, we have to call hematology and essentially was told he is a ""low priority"" patient and they wouldn't see him (they were rude, but I do get it because oncology patients need to take priority). Ortho refused to order the tests because ""we don't really order tests"" and said they'd send it to PCP. No follow-up scheduled with ortho until after the coag tests. This was about two weeks ago.About 10 days ago, his pain advanced so much that he finally did call in to the ortho clinic to as he was unable to sleep he was in so much pain. I picked up a script for 5mg oxycodone for him, and he's been taking this before bed reliably since and sometimes needs it during the day due to the pain. He hates it, and it barely touches the pain anyway. He called again last week because he is still in so much pain and essentially demanded to see the surgeon himself so we can get real answers about how we are not just going to ""manage"" the pain but resolve it. Thankfully, we see the surgeon tomorrow.Anyway, so today, we were able to meet with his PCP via telemedicine (he couldn't get to the actual hospital due to his limited mobility right now and still make it to the ortho appointment tomorrow). His PCP essentially said they a) weren't going to order any of the coag tests ortho wanted (they didn't have any notes from ortho and ""it isn't standard of care"") and if they wanted coag tests, they'd have to order themselves, and b) my husband ""needs"" to be more active, going to PT, walking, swimming if he can't put weight on it (note: the only pools here this time of year are at expensive gyms we cannot afford to go to), etc. My husband literally cannot do that. If he goes up and down the stairs more than once in a day, he's knocked on his ass in pain for the next 24 hours. He tried to impress this upon her, but she just kept saying how he needs to move it to avoid muscle atrophy, and if he can't, then the pain isn't managed appropriately. I don't disagree about his pain- it's not managed well at all- but her solution was to increase the gabapentin which tbh I don't think is helping him at all anyway. The bit about moving the joint more though directly goes against everything I've read about the disease, what the ortho told us, and what he experiences- he can manage his pain by being totally 100% sedentary, but that's not a lifestyle he wants (nor what is good long-term).So, wonderful docs of reddit, is he being managed appropriately so far? Is there something more I can do to ensure he has good care? I don't go into telemed visits with him since he takes him on headphones, but I do have to go with him when he goes in to the clinic since he cannot get around with me. I asked my older sis to send me some of the info on UpToDate so I can read more about what is actual standard of care. I cannot for the life of me feel good about it, and I feel like nobody is listening to him and his pain and what HE wants (solution, not management). Our world has radically shifted very rapidly, as he cannot do much at all or engage in hobbies or household chores or even the fun parts of a relationship most of the time. We are seeing a therapist to help manage it, even, but all the medical teams seem to be doing is throwing narcotics and giving him mixed messages and refusing to actually give us real insight into the disease process or why they don't want to resolve it. And yeah, I'm really mad about it all.Thanks again to anybody that can give me any insight into this. ###Output :Osteonecrosis / avascular necrosis of the hip, it can be bad. I kinda agree with the ortho - be as reluctant as possible with a hip prosthesis. I don't like the term ""hip replacement"", cause it makes it sound like you change the hip with an equivalent. It's not. A metal prosthesis has a limited life span - 10 - 20 years. Given enough time, the prosthesis will eventually fail. He's young, so he'll be doomed to have a failure while still in prime age. Then he'll have a bigger problem, since replacing a replacement is a much bigger surgery, sometimes it may not be possible at all, and there's a chance he'll have to remove a hip joint altogether while still only 40-some years old.There's a chance his osteonecrosis may dwindle, without completely destroying the femoral head. Sometimes it just leaves a small irregularity in the top joint surface, and it can be usable. I often see that the ""acute"" inflammation like necrosis dies out. It would be wise to wait and see how things progress. Hopefully, he can have pain relief with medications temporarily.So, I think the treatment right now seems wise. You want the problem to be solved right now with a hip replacement, but the ortho know that will bite you back in a few decades. When he says it's mild, he's probably referring to how it looks on xray, and mild there is a good thing.",ERROR,
"###Input :Ascites 4 weeks post-op, acute renal failureUpdate: Over 5L of fluid was drained from my dads abdomen today. The fluid was high in creatinine and consistent with urine. He initially felt much better, but then started experiencing extreme pain, likely from muscle spasms due to the drastic change in his body over the course if only 2 hours. His O2 dropped to 86 due to the pain. He is now medicated for pain and sleeping on and off. We are hoping that his status will improve over the next few days. Thank you to everyone that commented.70M, 6ft even, 205 lbs, Barrett's esophagus, eczemaHistory of heavy smoking decades ago that was reduced to once or twice per day in the 1980s. Uses edibles/microdosing to manage anxiety and depression.Regular medications include acid reducers for well-monitored esophagus and fish oils and supplements for controlled eczema. Very active lifestyle for age including managing half acre yard, frequent 15 to 20 mile bike rides when weather permits, strength training at gym multiple times per week.January 12th, dad underwent robot assisted prostate removal. Lymph nodes were clear and there was one area where cancer had spread one millimeter into outside tissues. No radiation is recommended at this time. He was disharged home with a catheter. The catheter was removed one week later, but about 18 hours after it was removed, he was having trouble urinating and developed severe pain. He went to the ER cathed again. He was determined to have continued swelling in his urethra.A few days later, a cystogram with his surgeon revealed a small tear in his bladder where his bladder and urethra meet. His surgeon said that he expects the tear to heal on its own.My dad was admitted to the ER today for increasing discomfort in his abdominal area with pain and diarrhea. When I showed up, I noticed that his abdomen was visibly distended. CT confirmed ascites. Nothing else to note other than a 2 mm calcification in a kidney and cirrhosis. He is a recovered alcoholic that hasn't touched alcohol in 37 years. Labs shows some RBCs and WBCs in his urine. Also indicated acute kidney failure. BUN 56 mg/dL, creatinine 4.54 mg/dL, eGFR-Cr 13 mL/min/1.73m2.It is a lymphatic leak? Maybe urine leak caused it? If so, what next? ###Output :In a patient with cirrhosis and new onset renal failure with swelling by the prostatic urethra, your dad appears to be at risk for urinary retention because of how much inflammation and swelling there is by the pelvis at the neck of the urethra. A simple noninvasive bladder scan can be done at the urologist's office after he voids or is allowed to empty his bladder completely , called a ""post void residual"". If there is more than 300-450 cc (every doc has their own cutoff) after a reasonable attempt to empty every last drop, he is considered to have urinary retention. This can cause urine to flow backwards and cause backpressure into the kidneys, effectively causing hydronephrosis (which can be picked up on a renal ultrasound (ultrasound of kidneys), or CT scan of the abdomen. Obstructive uropathy is this condition and can be source of renal failureAlso, ascites is not uncommon in decompensated cirrhosis. Make sure your dad is on a low salt diet. Also it is important to check a Complete metabolic panel or hepatic function panel to see his albumin level. Low albumin can contribute to ascites. Your dad could be in what we call hepatorenal syndrome if his cirrhosis is not under control and can lead to renal failure and death.",ERROR,
"###Input :Potential Renal neoplastyWent to er for massive dehydration and what I thought was a intestinal blockage. That issue resolved itself but during CT scan for blockages, etc, noticed something on my kidney.""Indeterminate lesion in the lower pole of the left kidney measuring 1.7 x 1.5 cm. This is suspicious for a possible renal neoplasm. A follow-up non emergent dedicated pre and post-contrast renal CT would be recommended to further evaluate.""Not asking for medical advice, going to get it further checked asap, but anyone with experience here - how concerned should I be? It's the weekend and I can't call pcp and I'm trying to keep my wife from panicking, honestly. The er doc seemed fairly concerned. ###Output :Based on CT results it's literally indeterminate. You need further imaging which will likely happen rather quickly.",ERROR,
"###Input :Update to Previous Post Regarding Cough Up Blood After Workout. Results Were SurprisingAge: 31Sex: MHeight: 6'6""Weight: 250 AthleticRace: White/CaucasianDuration: 4 1/2 MonthsLocation: Lungs/Upper Respiratory, Upper G/ICurrent Diagnosis: Stage 4 Aggressive Gastro-Intestinal CancerCurrent Meds: Pain Killers, DiureticsAs needed Meds: Lidocaine Patches, Anti-Nausea, Melatonin sleep aidOriginal: https://www.reddit.com/r/AskDocs/comments/c2ls61/chronic_cough_and_now_coughing_up_blood_after/?utm_medium=android_app&utm_source=shareSo after spending some time at an Urgent Care, getting some scans lined up and trying to be patient, I woke up one morning to pain and compression over my chest. Urgent Care Docs had advised me that any escalation of symptoms should mean I go to the Emergency Room. Once there they almost immediately checked me into the ICU for observation and began running every test you could name. For the next 4/5 days I did just an unreal number of scans, 2 biopsies, and they drew enough blood to fill a small pool. Pain escalated daily while there so finding a solution was a running theme. So after a lot of trails here's what they found:Current: Stage 4 Aggressive Metastatic Gastrointestinal Cancer ( Adenocarcinoma )Previous: Disseminated Intravascular CoagulationAfter doing a Lymph Node & Bone Marrow Biopsy they found my marrow filled to capacity with dead cancer cells. This pointed them in the right direction. My platelets were crashing daily (20,000 at admission) and I've got inflamed lymph nodes throughout my chest cavity which is one source of my (significant and at time escalating) pain. Its infiltrated my lungs and several vertebrae along my spine (causing vertebrae to show signs of Osteopenia) . Weirdly enough there's no noticeable tumor/mass/lump they can trace it back to. It's kind of just spread throughout (described as Adenocarcinoma) , though they were finally able to locate a small ulcer in my stomach that allowed them to finally be able to classify it. I've currently just completed my 3rd (now weekly) round of chemo (we started asap when other options such as clinical trials were deemed a non-option) and we've been able to stabilize a number of things (blood factors such as platelets, hemoglobin and the like) along the way. Many of my blood counts are still in the trash so clinical trails are not currently an option. In early stages of my 3 weeks hospital visit I was in a state called **DIC (**Disseminated Intravascular Coagulation) which caused me to act like something akin to a blood squirt gun if i bled. Essentialy it screws with you clotting factors and any bleeding event is an issue. Any procedure became an issue and many my numbers were artifically raised in order to attempt anything that would cause me to bleed. Fortunately after a week of treatments and what felt like several wheel barrows of infusions we kicked my body out of D.I.C and am more or less clotting normally. Fun story: early one morning after the vampires took their daily does of my blood a CNA came in to do a routine vitals check. This particular morning they took 2 unique sets of blood samples plus a rather large sample for testing against infectious disease. This was also kind of at the height of my ""he's not clotting"" phase. During the blood pressure check it popped open all the fresh holes in my arm, causing them to bleed and freaked/surprised the CNA. Made me laugh. (end of story). Immunotherapy is what my Oncologist are banking on right now so crossing my fingers. Chemo is causing reasonable progress (numbers are low but stable) so we're staying the course for now. My personal mid->long term goal is to find an alternative to opiates for pain management (who the hell knows why a person tolerates opiates for a buzz cause constipation sucks!!!) so looking at alternatives (THC pills potentially or preferably resolving the issue that's causing me pain) I've been discharged from the hospital after 3 weeks so now I'm working to find a routine that works. Losing weight so a short term goal is stopping that (I'm rather tall and (was) muscular so my bodies nuking whatever calories I put in and I'm not putting in a lot due to general nausea, but smoothies have been my friend. Please let me know if you have any questions or advice.. I'll answer what I can and absorb what reasonable advice I read. ###Output :Man, that was not high on my list of possibilities after your original description. Sorry to hear. Give it hell.",ERROR,
"###Input :Doctors please help my little sister, she can't walk, I'm afraid she's going to die8F, 78lbs, no medication. She was in the hospital for a long time but they discharged her. She is still in pain, please help. I attached the notes of her discharge.The patient is an 8-year-old white female with five weeks of fever, rash, arthralgias. Last month, the patient noted foot pain involving both left and right feet, as well as a blotchy pink rash on the leg that proceeded to spread to the trunk and then arms and then face during that week. The patient had low-grade fevers with temps to a max of 101. This has progressed to the week prior to admission higher fevers with T-max of 103.5. The patient has endorsed muscle pain, particularly in the right leg and arm, and PMD had seen the patient this week noted right knee and right index finger swelling. There is no noted weight change over this time period. No noted diarrhea or swollen nodes. The rash the patient described the week prior had an acute abrupt onset and 5-10 minutes later would dissipate.Rheumatology was consulted on the patient from admission. Lab studies were sent to rule-out an infectious etiology for rash. Strep culture was negative. EKG was also performed to rule-out a prolonged PR interval. EKG was within normal limits. A DNase B antibody was 547 and an ASO titer was 300. While results were elevated, the patient did no meet clinical criteria for rheumatic fever and diagnosis that was most likely entertained was systemic JIA. Further lab work included an ANA which was negative, rheumatoid factor which was negative, a CRP on admission was 8.6 mg/dL with an ESR about 80. CK and aldolase were within normal limits. Ferritin was elevated at 663. LDH was within normal limits. CBC was reassuring with normal white counts, hemoglobin and platelets; findings nonsuggestive of leukemia. Hepatic panel within normal limits. A chest x-ray was done to rule-out mediastinal mass, and that was negative. From an infectious standpoint, Parvo, CMV, EBV were all negative. Clinically the patient was noted to have a salmon-colored transient rash that would come and go throughout the hospitalization lasting a matter of minutes. No definite arthritis on examination. Oncology was consulted given the history of arthritis and fevers. It was felt in the setting of normal cell lines in evaluating a smear, which revealed no blasts, no indication of hepatomegaly or splenomegaly and uric acid and LDH within normal limits and x-ray that was normal, they felt that further oncologic evaluation was not indicated and a bone marrow was not indicated at that time. Cardiology was also officially consulted because the patient had a 2/6 ejection murmur on the exam. Cardiology felt the murmur was a flow murmur and evaluated the EKG, which they read as within normal limits, and decided an echo was not indicated to rule-out valvular disease in the setting of the rash and arthritis in an attempt to workup acute rheumatic fever. ###Output :Internal medicine doc here but in my differential is Adult Onset Stills Disease which can still present in children and Rocky Mountain Spotted Fever. The salmon colored rash lasting a few minutes is textbook for Adult Onset Stills Disease.I'm assuming she had blood cultures done at one or multiple points during her admission. Did she have a procalcitonin tested? Did she receive any antibiotics? Any steroids like solumedrol, prednisone etc? Does she still have joint pain? Does this rash show up only during febrile episodes? Any auto immune conditions in the family like lupus, rheumatoid arthritis, hashimotos?",ERROR,
"###Input :ostive ANA test, titer of 1:320 and speckled pattern, but negative Connective tissue testI'm a 35 yo Caucasian female, 5'5 and 170 lbs (back to back pregnancies), I vape, I take Omeprazole and lyrica 200 mg daily. The lyrica is for seizures, not pain.Ok, so I just had a bunch of labs drawn, because I've been having numerous symptoms of an autoimmune disease. Chronic fatigue, mouth sores that will randomly show up, lots of head aches, severe random bouts of pain that show up in joint areas that debilitates me when they ""flare up"". Crippling anxiety, and depression is worsening. And lastly, a random rash that will spread across my cheeks and nose, and sometimes radiate into the tips of my ears.I had a positive ANA test, but the more specific tests showed that I was negative for connective tissue disorders like lupus, RA and sjogrens to name a few. Everything looked fine, and my doctor told me that I probably just have inflammation somewhere in my body.My questions are:. Could I still have something like lupus, even tho the CTD labs were negative, but ANA had all 3 parts show abnormal results? And, this isn't my first positive ANA test. It happened 6 years ago, but nothing further was looked into. Where do I go from here to get better answers? All these symptoms are debilitating my life. ###Output :techincally you could still have something on the spectrum of connective tissue diseases with current antibodies negative, but +ANA are pretty common in the health population. best bet is probably continuous follow up with a single primary care doctor, and referral to whatever specialists they think best.",ERROR,
