text,interpretation,functional_tags
"###Input :8F, 78lbs, no medication. She was in the hospital for a long time but they discharged her. She is still in pain, please help. I attached the notes of her discharge.The patient is an 8-year-old white female with five weeks of fever, rash, arthralgias. Last month, the patient noted foot pain involving both left and right feet, as well as a blotchy pink rash on the leg that proceeded to spread to the trunk and then arms and then face during that week. The patient had low-grade fevers with temps to a max of 101. This has progressed to the week prior to admission higher fevers with T-max of 103.5. The patient has endorsed muscle pain, particularly in the right leg and arm, and PMD had seen the patient this week noted right knee and right index finger swelling. There is no noted weight change over this time period. No noted diarrhea or swollen nodes. The rash the patient described the week prior had an acute abrupt onset and 5-10 minutes later would dissipate.Rheumatology was consulted on the patient from admission. Lab studies were sent to rule-out an infectious etiology for rash. Strep culture was negative. EKG was also performed to rule-out a prolonged PR interval. EKG was within normal limits. A DNase B antibody was 547 and an ASO titer was 300. While results were elevated, the patient did no meet clinical criteria for rheumatic fever and diagnosis that was most likely entertained was systemic JIA. Further lab work included an ANA which was negative, rheumatoid factor which was negative, a CRP on admission was 8.6 mg/dL with an ESR about 80. CK and aldolase were within normal limits. Ferritin was elevated at 663. LDH was within normal limits. CBC was reassuring with normal white counts, hemoglobin and platelets; findings nonsuggestive of leukemia. Hepatic panel within normal limits. A chest x-ray was done to rule-out mediastinal mass, and that was negative. From an infectious standpoint, Parvo, CMV, EBV were all negative. Clinically the patient was noted to have a salmon-colored transient rash that would come and go throughout the hospitalization lasting a matter of minutes. No definite arthritis on examination. Oncology was consulted given the history of arthritis and fevers. It was felt in the setting of normal cell lines in evaluating a smear, which revealed no blasts, no indication of hepatomegaly or splenomegaly and uric acid and LDH within normal limits and x-ray that was normal, they felt that further oncologic evaluation was not indicated and a bone marrow was not indicated at that time. Cardiology was also officially consulted because the patient had a 2/6 ejection murmur on the exam. Cardiology felt the murmur was a flow murmur and evaluated the EKG, which they read as within normal limits, and decided an echo was not indicated to rule-out valvular disease in the setting of the rash and arthritis in an attempt to workup acute rheumatic fever. ###Output :Internal medicine doc here but in my differential is Adult Onset Stills Disease which can still present in children and Rocky Mountain Spotted Fever. The salmon colored rash lasting a few minutes is textbook for Adult Onset Stills Disease.I'm assuming she had blood cultures done at one or multiple points during her admission. Did she have a procalcitonin tested? Did she receive any antibiotics? Any steroids like solumedrol, prednisone etc? Does she still have joint pain? Does this rash show up only during febrile episodes? Any auto immune conditions in the family like lupus, rheumatoid arthritis, hashimotos?",ERROR,
"###Input :Age: 8Height/weight: Average, not sure exactly but last i was told, she's within normal rangeFemaleCaucasian/ HispanicNo previous medical history, no prior surgeriesnon-smoking householdWe all had covid in December 26th. It was rough but we all recovered. Me and my husband were vaccinated. My kids weren't because their clinic wasn't providing the vaccines yet.I'm going to try to be thorough as possible because it's just so much going on with her and i don't know where to start and her symptoms are all over the place... Last summer she was in someone's house that had a rabbit. The rabbit was filthy and it scratched the top part of her hand. Her hand began looking infected because even though i washed it and put neosporin on it, kids are kids and she couldn't keep it clean and soon it began looking red. She got a fever roughly around that time and was complaining of headaches and that her ""throat feels tight"". I took her to her clinic and they drew blood to test her for ""rabbit scratch fever"" It came back negative..They figured she just caught a virus and nothing became of it. The scratch eventually healed with an ointment they gave her. That same summer she..again...being a kid, didn't listen to me and was rolling in grass in her grandmother's yard which we have found ticks in. She ended up with a tick in her head which by the time we noticed it amongst her hair was engorged. I pried it off her. My daughter again, began complaining of headaches and her body hurting, ""tight"" throat. I took her to the ER and had her get tested for lyme disease it came back negative..It's now almost a year later and her headaches ""tight throat"" and body pain just come and go sporadically. I would chalk it up to growing pains which is what everyone was telling me. Her doctor never seems concerned...But sometimes the headaches are so intense she will cry and lay down and ask for a cold towel for her head...she's 8. And now on top of it all she's got new symptoms. She came to me about a week ago saying her butt felt weird like it had ""dots"". I tell her to show me and all over her butt and upper thigh area she is covered in what look to be pimples. Its so odd. My mind automatically went to ""bed bugs!"" So i checked the beds from top to bottom but found nothing. She still has trouble sleeping some nights and comes to sleep on our bed so if it was bed bugs why is she the only one with the dots? I'm checking her daily and it's as if she's got a new ""pimple"" everyday...again, she's 8...wth..Another new symptom she has is she's been getting heart palpitations. One minute she's playing on the floor or on the sofa, and the next she will come to me saying her heart is beating rapidly. I put my head on her heart and i feel her heart beating quickly. It scares her and i have to scoop her up and hold her for a while. She has also started hypervenilating when she's upset. Something she's NEVER done in her life. We aren't strict with her and she's a happy child, why would she start doing that? She says she can't help it.I took her to her doctor roughly two-three weeks ago because i had enough, i told her doctor everything from the summer to now. From the body pain to the heart pain and showed him her butt pimples and asked him to please help because we are at our wits end. He checked her out and said her heart sounds fine to him. He also was dismissive towards her skin problem. He did however notice the lymph nodes around her neck were really swollen. He ordered her to get blood work done and it came back last week. She has covid anti-bodies in her blood. She tested negative again for lyme (im guessing he just wanted to double check in case the other one was a false negative) and showed what he thinks might be her in ""Recovering"" state of cat scratch fever? ...ok? We have cats so i guess that's possible. He sounded so unsure with himself. Sighing a lot and kept going ""eh...i don't really know what to tell you..."" and stumped with her blood work. He sent her a prescription for Azithromycin just to be safe. She has to take this every day after dinner.Thing is, she's still complaining about her various symptoms. And it's been days since she got the medicine and now she's more frequently telling me her hearts beating quickly. So im afraid to continue giving her the medicine in case that's whats causing the palpitations. I have sent various messages to her doctor two days ago but he isn't calling me back. I'm tired of waiting for him and already went ahead and made her an appointment for both pediatric cardiology and dermatology. I also found a new pediatrician because i've had it with this guy. Both appointments are next week. But until then i'm just a bundle of nerves. I hate when she comes to me saying her heart hurts or her head hurts. Can anyone here please tell me whats wrong with my baby girl?Edit: were at the ER now. She started complaining of heart pain and palpitations and Im done waiting. Will update depending on what they say ###Output :Time for a new doctor. Its not typical for 8 year olds to get heart palpitations",ERROR,
"###Input :35F, 145lbs, 511 dont smoke, drink rarely. Generally consider myself healthy, however mid last year I underwent double jaw surgery and have since not taken part in any form of exercise and feel very unfit, but I still eat a well balance diet for the most part!After surgery however I lost over 20lbs in around 2 months and then gained it all back in the following 4 I had a hard time psychologically during recovery for a plethora of varied reasons and also unexpectedly became a carer for a relative who developed dementia whilst I was still recovering, this took a toll on mental health and I fell into a bit of a depression, I was prescribed Sertraline 50mg in late September 2022 however my mental health has VASTLY improved, it is my physical health that is bothersome.I also have a history of IBS and GERD (diagnosed over 10 years ago so is my normal but has slowly gotten a little worse over time).I reached out with no urgency to doctors for a health check as my generally sense of physical health felt at an all time low. I wanted to reassess IBS and GERD with focus on regular urgent diarrhoea (occasionally up to 6x a day), and regular nausea. Additionally I find myself easily very short of breath, dizzy and nauseous, and ultimately I feel weak. The disconcerting feeling this brings means I avoid any physical activity (historically I have enjoyed being more active). I noted that my heart rate has been falling lower and lower in the last 8 months since surgery and I am not physically fit at the moment. I feel slow. Maybe I am just getting old I was given a battery of tests and most of my bloods are generally fine, I have some deficiencies eg. Folate (which I queried as I dont drink and enjoy my greens) but was advised that some people are built different and need more vits or nutrients than others and I just need to take supplements  I assume this may cause some of my symptoms such as diarrhoea?I also had a 24hr Holter monitor and results came through yesterday. I havent seen them but doc noted 357 counts of bradycardia with lows of 37bpm. Coupled with my nausea and dizziness, I have an urgent referral to cardiology (although that still means in 3 months).However when I read up on Bradycardia, it doesnt seem to be a concerning issue? I dont have the full results but is it only the coupling of my nausea etc that makes it more concerning. Unsure if relevant, but despite low heart rate I often have slightly high blood pressure.Tldr: is bradycardia with nausea and dizziness worthy of urgent cardiology referral? Can heart issues cause additional symptoms such as regular diarrhoea?Also not sure if relevant, but I had a persistent rash and redness and deep itch in left breast for last 2 months, ultrasound shows I have lots of benign cysts and a fibroadenoma, they (radiologist and consultant) seemed unconcerned but did biopsy due to my age and I will get results soon, the lack of concern from consultant means I have little concern also (my mother has fibroadenomas that have never caused any issues), but thought I would add everything that ails me! Ha! In case there is some magical connection to it all.Thanks! ###Output :What is your normal heart rate? Was it sinus bradycardia? How long were these episodes in duration?. Also would be helpful to know any medications other than the SSRI and whether you have sleep apnea, have had Lyme or chagas disease or are hypothyroid.To he honest I would also be surprised if it is sinus bradycardia that it is causing your symptoms rather than vice versa. Nausea and bowel movements are an excellent way to temporarily lower your heart rate. Most often it is just a normal variant, and if it is sinus bradycardia almost never requires a pacemaker. Wouldnt get too overwrought.The downside is i there is no magical connection here to any issue other than maybe being a symptom of nausea, which isnt that magical.",ERROR,
"###Input :31F, went to the ER due to stomach pain and uncontrollable shivering. She was admitted to the ICU and had extremely low blood sugar, hypothermia, hyperkalemia, blood in the stool, gram positive cocci in pairs and chains, anemia, and she had been previously diagnosed with endometriosis. They found cysts in the liver, hypodensity in the left side of the brain and have been taking several tests. ER gave her 3 blood transfusions for the anemia and she now has a swollen back, legs, hands, and feet. She is still anemic even after the 3 blood transfusions. She has undergone multiple MRI, ultrasounds, CAT scans, and blood works but they aren't sure what is causing everything.Her vitals at admission were:K 5.9Hgb 5.5Glucose 17Temp 94.5WBC 5700She started antibiotics yesterday morning and her second ecg was normal. She was taking oxycodone for pain but is now on morphine and lidocaine. Doctors said that she had a reaction to her 3rd blood transfusion and her heart rate went up and blood pressure went down. She is now on medication for that. She has not been allowed any food or water today after the reaction. An MRI found that she has lesions in her brain but the nuero surgery consultant said they were not going to do any procedure.Has anyone had experience with something similar and what was the diagnosis? ###Output :While I have lots of experience with patients like her, I dont think theres much that can be said over the internet to help. She has a severe critical illness with what sounds like septic shock. The best people to answer your questions is the team of doctor taking care of your sister.",ERROR,
"###Input :29F, 5'2, 80 something lbs, end stage liver failure etc.This one might be long, but I appreciate any kind of advice or input. I'm concerned my sister has been kind of pushed to the side since COVID19 and she's currently in critical, critical condition despite having been discharged. My family is confused on what to do, how to help her, especially since she's been denied a liver transplant. But anyways, here it goes:On March 5th my sister was found collapsed on her bathroom floor, she was completely yellow. Her boyfriend rushed her to the ER, where he was told to call family (us) because she wouldn't make it. From there she was transferred to a larger hospital, placed in surgical ICU and had a team immediately on her case. At this point her liver was failing, and she had an infection but they didn't know the source nor the bacteria causing it. She couldn't breathe on her own etc. Over the next week they threw all the antibiotics at her hoping something would stick, put a tube in her stomach to drain fluid that had built up around her bladder, put her on 24/7 dialysis since her kidneys began to fail, so many tests ran, I unfortunately can't recall all the details right now but if there are any specific questions I can likely answer.It was very touch and go for a while but her fever had gone away despite never finding out the source of infection. She was tolerating the dialysis and the last day I saw her she looked like she was doing a little bit better. Then COVID-19 hit my state and we were no longer allowed to visit her. Phone updates from the RN told us she was doing better, but they never had any specific information on what specific doctor's were saying, questions we had just weren't getting answered and my sister was unable to tell us what was going on. Within one week, we were told she was well enough to go down to general, despite previously being told she would go down to regular ICU first, and be in the hospital for at the very least a total of 6 weeks. She could breathe (not very well) on her own at this point and could communicate, so the hospital was no longer relaying information to us despite her not being in good enough condition to actually understand what was going on and couldn't remember what doctor's were saying to her. The next day we get a call that she's getting a port placed for out patient dialysis, and she was discharged that same day.We knew she wouldn't be 100% obviously but thought she would be better than she is. She comes home and can't walk, can't breathe very well at all, is completely yellow, is in constant pain and honestly looks like she won't be able to make it much longer. We don't know if she can survive with this liver, she was denied a transplant (whole 'nother story) and despite getting outpatient dialysis she looks worse and worse. She was told she was getting a home care nurse, they aren't coming now. She was supposed to originally be getting PT, they won't come out anymore (honestly don't think she's at that point now anyways). I'm trying to facilitate the care she needs and I'm trying to get her appointments set up but all doctors are only doing video call (completely understand). I'm just so scattered right now and have no idea why she was discharged. Should I take her back? Will they even be able to do anything? I don't understand and I'm just looking for any kind of advice I can get.Edit: The liver failure was precipitated by alcohol abuse and exasperated by the sepsis from her bladder infection. The last we had heard from the transplant team was that she was considered a good candidate (after 3 interviews) despite the alcohol abuse. We got a letter in the mail yesterday stating the denial. I am not trying to negate from the alcohol abuse, that was the reason her liver failed. Just that she also had a lot else going on that led to the condition she is in. ###Output :Posts by unflaired users that claim legitimacy by virtue of professional medical experience are not allowed.If you are a medical professional who wishes to become a verified contributor to this subreddit, please message the moderators with a link to a picture of your medical ID, student ID, diploma, or other form of verification. Imgur.com is convenient, but you can host anywhere. Please block out personal information, such as your name and picture. You must include your reddit username in the photo!We do not accept digital forms of identification.",ERROR,
"###Input :To clarify, just because the organs aren't necrotic doesn't mean they are functioning. Also organ donation has nothing to do with DNR. The appropriateness of someone to donate only comes after they have died or are literally about to. In the US people self-declare at the DMV so the organ donation services already know their intent in most cases.He has multisystem organ failure, plus underlying conditions which will make his recovery harder than someone without those (alcoholism, solitary kidney) based on what you have written, so it is absolutely imperative to find out what his wishes might be regarding code status. In the absence of any clear directives from the patient in the past, the family is asked to predict what the patient would choose for themself if they were able to sit in on the discussion and weigh in--basing this off of past comments, how they engaged (or avoided) healthcare interventions on their own, etc.I suggest that his designated healthcare agent and any other family present, have a care conference with the intensivist. This is a time set aside in a nearby conference room, not at the bedside or in the hall. Include one of his nurses if possible, any specialists who can make it (often harder to arrange) and then the unit's social worker/case manager. The purpose is to outline exactly where he is on his trajectory, what the major challenges are, what the expected chances of recovery appear to be at this point, and then a discussion of next steps. Find out more about why the doctor was recommending DNR. Hear what they have to say about this based on their experience. It might be because they don't feel he will likely be resuscitated if they make attempts, therefore, to attempt shocks and compressions would be futile. If they feel it would be futile, then it would represent only harm to the patient and not comfort or cure. I cannot predict what they are thinking so you need to find out, but this has been my experience from working in ICU as an RN and Care Manager.If he cannot be weaned off of the vent shortly, he will need a trach and a PEG (feeding tube in his side). If he stabilizes enough to be discharged from ICU (off of CRRT, off of high vent settings, off of any vasopressors that are stabilizing his BP, only on X number of antibiotics, etc) then he will meet criteria to transfer to a ventilator rehabilitation hospital or LTACH (long term acute care hospital).If this happens, it is a long slog. Is it something he would want? Also, he might not survive it and could have a downturn at any time, heading back to the hospital. Knowing this, is this something the family would predict HE would want? If so, you have your answer. If not, then it is appropriate to consult hospice to make him comfortable. Another service to consult if you have it available is Palliative Care. In many hospitals they are consulted for complex cases like this who are taking a long time to recover. They are particularly helpful to the patient to improve quality of life while recovering, as well as provide support and guidance to family.At the end of this long post, I offer you two things. One-you are in my thoughts. I know how difficult this is and you are on a crash course of learning right now. Two, please use this resource that many families in your position find extremely helpful--patients let us know so often this has helped them in cases like yours: Hard Choices for Loving People booklet ###Output :If this was me I would want a DNR and a DNI signed. More importantly, I would want a MOLST form singed indicating exactly the care that I would want, the care that I don't want, and for how long. That is to say, give me antibiotics for one week and see how I do, if nothing's happening then stop all unnecessary treatments.What I like to see in patients is an end goal. What happens far too often, is patients will sit in an ICU for an extended period of time deconditioning and not getting better, but family does not want to do anything for fear of making the situation worse or feeling like they are murdering a family member by taking away care. Recognize that his pancreas is not well at all. His kidneys are not well at all. His liver is not well at all. Assumedly, his lungs aren't either.Let's say he is extubated. Now we have a burnt pancreas. And kidney. And liver. If you are this young and have liver dysfunction or failure, that's a life of slowly getting sicker and sicker until you can possibly but probably not get a liver transplant in the future. It's painful. If his kidneys are truly shot and he requires dialysis in the future, that's 50 years of spending 3 days a week going to get dialysis and sitting there having your blood cycled over and over for hours, just to go home and not feel well. Then you do it again. Then you do it again. That's a lot of stress for a 30-year-old. A 30-year-old that already has alcoholism. If your pancreas is constantly becoming inflamed, diabetes maybe in the future or at least insulin dependence. A 30-year-old diabetic will have a low quality of life.DNR and DNIs are to preserve a patient's dignity thinking about the long-term consequences to their health and quality of life. The idea that saving people is enough, is not enough. By stating do not resuscitate, You're saying to give a chance, but don't take it farther than he would like given all that has happened, and will happen in the future.The doctor sees this all the time. The doctor sees a family that holds on to hope that everything will be okay because their family member is "" a fighter, "" but neglects to see that the patient has already fought 25 rounds and has been knocked out three times. And also neglects to see that, if they come out of the fight, they essentially will have an agonizing future for the rest of their life.",ERROR,
